{
  "schema_version": "1.0.0",
  "lesson_id": "half_steps_one_string",
  "sequence": 1,
  "position_tick": 0,
  "position_seconds": 0.0,
  "playing": false,
  "playback_rate": 1.0,
  "loop_enabled": false,
  "repetition_index": 0,
  "loop_start_tick": null,
  "loop_end_tick": null,
  "loop_start_seconds": null,
  "loop_end_seconds": null
}
